{
  "schema_version": "1",
  "kind": "npc_melee_simulation",
  "request_id": "example:melee",
  "ruleset": "towr-pg1.4-gmg1.1",
  "simulation": {
    "master_seed": "42",
    "trials": 8,
    "round_budget": 3
  },
  "execution": {
    "mode": "sequential"
  },
  "scenario": {
    "definitions": [
      {
        "id": "example:footpad",
        "source_rule_id": "RULE-PROFILE-TALABEC-005",
        "resilience": {
          "toughness": 3,
          "bonus": 0
        },
        "attack": {
          "id": "dagger",
          "source_rule_id": "RULE-PROFILE-TALABEC-005:dagger",
          "dice": 3,
          "threshold": 3,
          "damage": 2,
          "hands": "1h"
        },
        "protection": {
          "source_rule_id": "RULE-PROFILE-TALABEC-005:protection",
          "skill": "athletics",
          "dice": 3,
          "threshold": 3
        }
      }
    ],
    "actors": [
      {
        "id": "P1",
        "definition_id": "example:footpad",
        "side": "players_and_allies",
        "zone_id": "arena"
      },
      {
        "id": "P2",
        "definition_id": "example:footpad",
        "side": "players_and_allies",
        "zone_id": "arena"
      },
      {
        "id": "E1",
        "definition_id": "example:footpad",
        "side": "opposition",
        "zone_id": "arena"
      },
      {
        "id": "E2",
        "definition_id": "example:footpad",
        "side": "opposition",
        "zone_id": "arena"
      }
    ],
    "battlefield": {
      "zone_ids": [
        "arena",
        "exit"
      ],
      "connections": [
        {
          "first_zone_id": "arena",
          "second_zone_id": "exit"
        }
      ]
    },
    "side_order": [
      "players_and_allies",
      "opposition"
    ],
    "actor_order": [
      "P1",
      "P2",
      "E1",
      "E2"
    ],
    "perspective_side": "players_and_allies",
    "objective_target_ids": [
      "E1",
      "E2"
    ],
    "facts": {
      "zone_id": "arena",
      "all_opponents_in_close_range": true,
      "targets_aware": true,
      "clear_line_of_sight": true,
      "stationary": true,
      "all_zone_combatants_included": true,
      "unmounted_combatants_only": true,
      "no_higher_ground": true,
      "no_additional_rules": true,
      "no_other_test_modifiers": true,
      "can_leave_zone": true
    },
    "repeated_stagger_choice": "suffer_wound",
    "actor_policies": [
      {
        "actor_id": "P1",
        "outnumbering_bonus_approved": true,
        "targets": [
          {
            "target_id": "E1",
            "disposition": "knocked_out",
            "gm_approved": true
          },
          {
            "target_id": "E2",
            "disposition": "knocked_out",
            "gm_approved": true
          }
        ]
      },
      {
        "actor_id": "P2",
        "outnumbering_bonus_approved": true,
        "targets": [
          {
            "target_id": "E1",
            "disposition": "knocked_out",
            "gm_approved": true
          },
          {
            "target_id": "E2",
            "disposition": "knocked_out",
            "gm_approved": true
          }
        ]
      },
      {
        "actor_id": "E1",
        "outnumbering_bonus_approved": true,
        "targets": [
          {
            "target_id": "P1",
            "disposition": "knocked_out",
            "gm_approved": true
          },
          {
            "target_id": "P2",
            "disposition": "knocked_out",
            "gm_approved": true
          }
        ]
      },
      {
        "actor_id": "E2",
        "outnumbering_bonus_approved": true,
        "targets": [
          {
            "target_id": "P1",
            "disposition": "knocked_out",
            "gm_approved": true
          },
          {
            "target_id": "P2",
            "disposition": "knocked_out",
            "gm_approved": true
          }
        ]
      }
    ]
  }
}
